mysql> CREATE DATABASE shirts_db;
Query OK, 1 row affected (0.01 sec)

mysql> USE shirts_db;

mysql> CREATE TABLE shirts
    -> (
    ->   shirt_id INT NOT NULL AUTO_INCREMENT,
    ->   article VARCHAR(255),
    ->   color VARCHAR(255),
    ->   shirt_size VARCHAR(255),
    ->   last_worn INT,
    ->   PRIMARY KEY (shirt_id)
    -> );
Query OK, 0 rows affected (0.13 sec)

mysql> DESC shirts;
+------------+--------------+------+-----+---------+----------------+
| Field      | Type         | Null | Key | Default | Extra          |
+------------+--------------+------+-----+---------+----------------+
| shirt_id   | int(11)      | NO   | PRI | NULL    | auto_increment |
| article    | varchar(255) | YES  |     | NULL    |                |
| color      | varchar(255) | YES  |     | NULL    |                |
| shirt_size | varchar(255) | YES  |     | NULL    |                |
| last_worn  | int(11)      | YES  |     | NULL    |                |
+------------+--------------+------+-----+---------+----------------+
5 rows in set (0.00 sec)

mysql> INSERT INTO shirts (article, color, shirt_size, last_worn) VALUES
    -> ('t-shirt', 'white', 'S', 10),
    -> ('t-shirt', 'green', 'S', 200),
    -> ('polo shirt', 'black', 'M', 10),
    -> ('tank top', 'blue', 'S', 50),
    -> ('t-shirt', 'pink', 'S', 0),
    -> ('polo shirt', 'red', 'M', 5),
    -> ('tank top', 'white', 'S', 200),
    -> ('tank top', 'blue', 'M', 15);
Query OK, 8 rows affected (0.01 sec)
Records: 8  Duplicates: 0  Warnings: 0

mysql> SELECT * FROM shirts;
+----------+------------+-------+------------+-----------+
| shirt_id | article    | color | shirt_size | last_worn |
+----------+------------+-------+------------+-----------+
|        1 | t-shirt    | white | S          |        10 |
|        2 | t-shirt    | green | S          |       200 |
|        3 | polo shirt | black | M          |        10 |
|        4 | tank top   | blue  | S          |        50 |
|        5 | t-shirt    | pink  | S          |         0 |
|        6 | polo shirt | red   | M          |         5 |
|        7 | tank top   | white | S          |       200 |
|        8 | tank top   | blue  | M          |        15 |
+----------+------------+-------+------------+-----------+
8 rows in set (0.06 sec)

mysql> INSERT INTO shirts (article, color, shirt_size, last_worn)
    -> VALUES ('polo shirt', 'purple', 'M', 50);
Query OK, 1 row affected (0.09 sec)

mysql> SELECT * FROM shirts;
+----------+------------+--------+------------+-----------+
| shirt_id | article    | color  | shirt_size | last_worn |
+----------+------------+--------+------------+-----------+
|        1 | t-shirt    | white  | S          |        10 |
|        2 | t-shirt    | green  | S          |       200 |
|        3 | polo shirt | black  | M          |        10 |
|        4 | tank top   | blue   | S          |        50 |
|        5 | t-shirt    | pink   | S          |         0 |
|        6 | polo shirt | red    | M          |         5 |
|        7 | tank top   | white  | S          |       200 |
|        8 | tank top   | blue   | M          |        15 |
|        9 | polo shirt | purple | M          |        50 |
+----------+------------+--------+------------+-----------+
9 rows in set (0.00 sec)

mysql> SELECT article, color FROM shirts;
+------------+--------+
| article    | color  |
+------------+--------+
| t-shirt    | white  |
| t-shirt    | green  |
| polo shirt | black  |
| tank top   | blue   |
| t-shirt    | pink   |
| polo shirt | red    |
| tank top   | white  |
| tank top   | blue   |
| polo shirt | purple |
+------------+--------+
9 rows in set (0.00 sec)

mysql> SELECT article, color, shirt_size, last_worn FROM shirts WHERE shirt_size ='M';
+------------+--------+------------+-----------+
| article    | color  | shirt_size | last_worn |
+------------+--------+------------+-----------+
| polo shirt | black  | M          |        10 |
| polo shirt | red    | M          |         5 |
| tank top   | blue   | M          |        15 |
| polo shirt | purple | M          |        50 |
+------------+--------+------------+-----------+
4 rows in set (0.00 sec)

mysql> UPDATE shirts SET shirt_size='L' where article='polo shirt';
Query OK, 3 rows affected (0.01 sec)
Rows matched: 3  Changed: 3  Warnings: 0

mysql> SELECT article, shirt_size FROM shirts;
+------------+------------+
| article    | shirt_size |
+------------+------------+
| t-shirt    | S          |
| t-shirt    | S          |
| polo shirt | L          |
| tank top   | S          |
| t-shirt    | S          |
| polo shirt | L          |
| tank top   | S          |
| tank top   | M          |
| polo shirt | L          |
+------------+------------+
9 rows in set (0.00 sec)

mysql> UPDATE shirts SET last_worn=0 WHERE last_worn=15;
Query OK, 1 row affected (0.01 sec)
Rows matched: 1  Changed: 1  Warnings: 0

mysql> SELECT article, last_worn FROM shirts;
+------------+-----------+
| article    | last_worn |
+------------+-----------+
| t-shirt    |        10 |
| t-shirt    |       200 |
| polo shirt |        10 |
| tank top   |        50 |
| t-shirt    |         0 |
| polo shirt |         5 |
| tank top   |       200 |
| tank top   |         0 |
| polo shirt |        50 |
+------------+-----------+
9 rows in set (0.00 sec)

mysql> UPDATE shirts SET shirt_size='XS', color='off white' WHERE color='white';
Query OK, 2 rows affected (0.09 sec)
Rows matched: 2  Changed: 2  Warnings: 0

mysql> SELECT article, color, shirt_size FROM shirts;
+------------+-----------+------------+
| article    | color     | shirt_size |
+------------+-----------+------------+
| t-shirt    | off white | XS         |
| t-shirt    | green     | S          |
| polo shirt | black     | L          |
| tank top   | blue      | S          |
| t-shirt    | pink      | S          |
| polo shirt | red       | L          |
| tank top   | off white | XS         |
| tank top   | blue      | M          |
| polo shirt | purple    | L          |
+------------+-----------+------------+
9 rows in set (0.00 sec)

mysql> DELETE FROM shirts WHERE last_worn=200;
Query OK, 2 rows affected (0.02 sec)

mysql> SELECT * FROM shirts;
+----------+------------+-----------+------------+-----------+
| shirt_id | article    | color     | shirt_size | last_worn |
+----------+------------+-----------+------------+-----------+
|        1 | t-shirt    | off white | XS         |        10 |
|        3 | polo shirt | black     | L          |        10 |
|        4 | tank top   | blue      | S          |        50 |
|        5 | t-shirt    | pink      | S          |         0 |
|        6 | polo shirt | red       | L          |         5 |
|        8 | tank top   | blue      | M          |         0 |
|        9 | polo shirt | purple    | L          |        50 |
+----------+------------+-----------+------------+-----------+
7 rows in set (0.00 sec)

mysql> DELETE FROM shirts WHERE article='tank top';
Query OK, 2 rows affected (0.04 sec)

mysql> SELECT * FROM shirts;
+----------+------------+-----------+------------+-----------+
| shirt_id | article    | color     | shirt_size | last_worn |
+----------+------------+-----------+------------+-----------+
|        1 | t-shirt    | off white | XS         |        10 |
|        3 | polo shirt | black     | L          |        10 |
|        5 | t-shirt    | pink      | S          |         0 |
|        6 | polo shirt | red       | L          |         5 |
|        9 | polo shirt | purple    | L          |        50 |
+----------+------------+-----------+------------+-----------+
5 rows in set (0.00 sec)

mysql> DELETE FROM shirts;
Query OK, 5 rows affected (0.01 sec)

mysql> SELECT * FROM shirts;
Empty set (0.00 sec)

mysql> DROP TABLE shirts;
Query OK, 0 rows affected (0.04 sec)

mysql> SHOW TABLES;
Empty set (0.00 sec)
